{
  "project": "singular-hub",
  "repository": "julianleno/singular",
  "default_branch": "main",
  "default_branch_sha": "00a97ddaa7f8c869ff1929f6c963906f3d5b845e",
  "freshness": {
    "verified_at": "2026-08-19T07:29:00-03:00",
    "requires_live_recheck": true
  },
  "priority_order": ["XBZ", "catalog-proposal", "public-pdf"],
  "active_workstreams": [
    {
      "id": "247",
      "status": "active",
      "agent": "agent-b",
      "front_ref": "fronts/247.json",
      "depends_on": []
    },
    {
      "id": "309",
      "status": "waiting-human",
      "agent": "kimi-k3",
      "front_ref": "fronts/309.json",
      "depends_on": []
    }
  ],
  "next_human_decisions": [
    "After the updated pgTAP on #308 passes and exact-head validation is green, decide whether to authorize merge #308",
    "Review the refined Direction B in #312; only explicit visual approval authorizes production PDF implementation",
    "After #308 is merged, run #248 XBZ end-to-end QA before closing #231; issue closures remain explicit human mutations"
  ],
  "updated_at": "2026-08-19T07:29:00-03:00"
}
